{
  "$schema": "https://json-schema.org/draft/2020-12/schema",
  "title": "ModuleGraph",
  "description": "Complete analysis result for a project",
  "type": "object",
  "required": ["schemaVersion", "language", "modules", "cycles", "warnings", "status"],
  "properties": {
    "schemaVersion": {
      "type": "string",
      "enum": ["1.0", "1.1", "1.2", "1.3"],
      "description": "Version of the output schema. Consumers check this to detect breaking changes in the JSON structure."
    },
    "language": {
      "type": "string",
      "minLength": 1,
      "description": "Lowercase language identifier (e.g., \"go\", \"python\")."
    },
    "modules": {
      "type": "array",
      "description": "Analysis results for each module in the project.",
      "items": {
        "type": "object",
        "required": ["path", "name", "ca", "ce", "instability", "abstractness", "distance", "lcom", "exportedTypes", "abstractTypes", "zone"],
        "properties": {
          "path": {
            "type": "string",
            "description": "Unique identifier for this module (e.g., \"github.com/foo/bar\")."
          },
          "name": {
            "type": "string",
            "description": "Human-readable short name (e.g., \"bar\")."
          },
          "ca": {
            "type": "integer",
            "minimum": 0,
            "description": "Afferent coupling — the number of modules that depend on this module."
          },
          "ce": {
            "type": "integer",
            "minimum": 0,
            "description": "Efferent coupling — the number of modules this module depends on."
          },
          "instability": {
            "type": "number",
            "minimum": 0,
            "maximum": 1,
            "description": "Instability metric I = Ce / (Ca + Ce), in [0, 1]."
          },
          "abstractness": {
            "type": "number",
            "minimum": 0,
            "maximum": 1,
            "description": "Abstractness A = abstractTypes / totalExported, in [0, 1]."
          },
          "distance": {
            "type": "number",
            "minimum": 0,
            "maximum": 1,
            "description": "Distance from main sequence D = |A + I - 1|, in [0, 1]."
          },
          "lcom": {
            "type": "integer",
            "minimum": 0,
            "description": "Lack of Cohesion of Methods (LCOM4 variant); the number of connected components."
          },
          "exportedTypes": {
            "type": "integer",
            "minimum": 0,
            "description": "Total count of exported types in this module."
          },
          "abstractTypes": {
            "type": "integer",
            "minimum": 0,
            "description": "Count of abstract types (e.g., Go interfaces, Python ABCs)."
          },
          "zone": {
            "type": "string",
            "enum": ["main-sequence", "zone-of-pain", "zone-of-uselessness", "normal"],
            "description": "Classification of the module's position relative to the main sequence."
          },
          "totalLines": {
            "type": "integer",
            "minimum": 0,
            "description": "Total number of lines across all source files in this module. Zero indicates the line count could not be determined."
          },
          "duplications": {
            "type": "array",
            "description": "Detected structurally similar code blocks within this module. An empty array indicates no duplications were detected.",
            "items": {
              "type": "object",
              "required": ["modulePath", "blocks", "similarity"],
              "properties": {
                "modulePath": {
                  "type": "string",
                  "description": "Unique identifier for the module containing the duplicate blocks."
                },
                "blocks": {
                  "type": "array",
                  "description": "Locations of the duplicate code blocks. At least two blocks per duplication.",
                  "items": {
                    "type": "object",
                    "required": ["file", "startLine", "endLine", "lineCount"],
                    "properties": {
                      "file": {
                        "type": "string",
                        "description": "Path to the source file containing this block, relative to the project root."
                      },
                      "startLine": {
                        "type": "integer",
                        "minimum": 1,
                        "description": "1-indexed line number where the duplicate block begins."
                      },
                      "endLine": {
                        "type": "integer",
                        "minimum": 1,
                        "description": "1-indexed line number where the duplicate block ends (inclusive)."
                      },
                      "lineCount": {
                        "type": "integer",
                        "minimum": 0,
                        "description": "Number of significant lines in this block, excluding blank lines and single-token lines."
                      }
                    },
                    "additionalProperties": false
                  }
                },
                "similarity": {
                  "type": "number",
                  "minimum": 0,
                  "maximum": 1,
                  "description": "Structural similarity score between the blocks, in [0, 1]. 1.0 means structurally identical after normalization."
                }
              },
              "additionalProperties": false
            }
          },
          "extensions": {
            "type": "object",
            "description": "Language-specific metric extensions namespaced by language (e.g., \"go.interfaceWidth\")."
          }
        },
        "additionalProperties": false
      }
    },
    "cycles": {
      "type": "array",
      "description": "Detected circular dependencies between modules, each reported as a lexicographically-sorted set of module paths.",
      "items": {
        "type": "array",
        "items": { "type": "string" }
      }
    },
    "warnings": {
      "type": "array",
      "description": "Language-specific caveats about metric accuracy. Always present (empty when there are none).",
      "items": {
        "type": "object",
        "required": ["code", "message"],
        "properties": {
          "code": {
            "type": "string",
            "description": "Machine-readable warning identifier (e.g., \"load-error\")."
          },
          "message": {
            "type": "string",
            "description": "Human-readable description of the warning."
          },
          "module": {
            "type": "string",
            "description": "Path of the affected module (empty if the warning applies globally)."
          }
        },
        "additionalProperties": false
      }
    },
    "status": {
      "type": "string",
      "enum": ["complete", "partial", "error"],
      "description": "Overall analysis outcome."
    },
    "provenance": {
      "type": "object",
      "description": "Optional metadata about how the graph was produced (producer, version, timestamp, input). Omitted for byte-reproducible output.",
      "required": ["producer", "version", "generatedAt", "input"],
      "properties": {
        "producer": {
          "type": "string",
          "description": "Name of the tool that produced the graph (e.g., \"vibe-check\")."
        },
        "version": {
          "type": "string",
          "description": "Semantic version of the producing tool (e.g., \"0.1.0\")."
        },
        "generatedAt": {
          "type": "string",
          "description": "RFC3339 UTC timestamp at which the graph was produced."
        },
        "input": {
          "type": "object",
          "description": "Identifies the source that was analyzed.",
          "required": ["path", "modulePath"],
          "properties": {
            "path": {
              "type": "string",
              "description": "Path to the analyzed project directory."
            },
            "modulePath": {
              "type": "string",
              "description": "Resolved module import path (e.g., \"github.com/foo/bar\")."
            }
          },
          "additionalProperties": false
        }
      },
      "additionalProperties": false
    }
  },
  "additionalProperties": false
}
