{
  "schemaVersion": "1.3",
  "language": "typescript",
  "modules": [
    {
      "path": ".",
      "name": ".",
      "ca": 0,
      "ce": 0,
      "exportedTypes": 0,
      "abstractTypes": 0,
      "instability": 0,
      "abstractness": 0,
      "distance": 1,
      "lcom": 0,
      "zone": "zone-of-pain",
      "duplications": [],
      "totalLines": 0
    },
    {
      "path": "src",
      "name": "src",
      "ca": 0,
      "ce": 0,
      "exportedTypes": 5,
      "abstractTypes": 4,
      "instability": 0,
      "abstractness": 0.8,
      "distance": 0.19999999999999996,
      "lcom": 2,
      "zone": "main-sequence",
      "duplications": [],
      "totalLines": 0
    },
    {
      "path": "src/cycle-a",
      "name": "cycle-a",
      "ca": 1,
      "ce": 1,
      "exportedTypes": 0,
      "abstractTypes": 0,
      "instability": 0.5,
      "abstractness": 0,
      "distance": 0.5,
      "lcom": 0,
      "zone": "normal",
      "duplications": [],
      "totalLines": 0
    },
    {
      "path": "src/cycle-b",
      "name": "cycle-b",
      "ca": 1,
      "ce": 1,
      "exportedTypes": 0,
      "abstractTypes": 0,
      "instability": 0.5,
      "abstractness": 0,
      "distance": 0.5,
      "lcom": 0,
      "zone": "normal",
      "duplications": [],
      "totalLines": 0
    }
  ],
  "cycles": [
    [
      "src/cycle-a",
      "src/cycle-b"
    ]
  ],
  "warnings": [
    {
      "code": "cycle-approximation",
      "message": "cycle-approximation"
    },
    {
      "code": "directory-as-module",
      "message": "directory-as-module"
    },
    {
      "code": "error-budget",
      "message": "error-budget"
    },
    {
      "code": "ts-abstractness-bias",
      "message": "ts-abstractness-bias"
    },
    {
      "code": "unsupported-metric",
      "message": "unsupported-metric"
    }
  ],
  "status": "partial"
}
