{
  "schemaVersion": "1.3",
  "language": "python",
  "modules": [
    {
      "path": "fixturepy",
      "name": "fixturepy",
      "ca": 0,
      "ce": 0,
      "exportedTypes": 4,
      "abstractTypes": 1,
      "instability": 0,
      "abstractness": 0.25,
      "distance": 0.75,
      "lcom": 6,
      "zone": "normal",
      "duplications": [],
      "totalLines": 0
    },
    {
      "path": "fixturepy.cycle_a",
      "name": "cycle_a",
      "ca": 1,
      "ce": 1,
      "exportedTypes": 0,
      "abstractTypes": 0,
      "instability": 0.5,
      "abstractness": 0,
      "distance": 0.5,
      "lcom": 0,
      "zone": "normal",
      "duplications": [],
      "totalLines": 0
    },
    {
      "path": "fixturepy.cycle_b",
      "name": "cycle_b",
      "ca": 1,
      "ce": 1,
      "exportedTypes": 0,
      "abstractTypes": 0,
      "instability": 0.5,
      "abstractness": 0,
      "distance": 0.5,
      "lcom": 0,
      "zone": "normal",
      "duplications": [],
      "totalLines": 0
    },
    {
      "path": "fixturepy.operations",
      "name": "operations",
      "ca": 0,
      "ce": 0,
      "exportedTypes": 0,
      "abstractTypes": 0,
      "instability": 0,
      "abstractness": 0,
      "distance": 1,
      "lcom": 0,
      "zone": "zone-of-pain",
      "duplications": [],
      "totalLines": 0
    }
  ],
  "cycles": [
    [
      "fixturepy.cycle_a",
      "fixturepy.cycle_b"
    ]
  ],
  "warnings": [
    {
      "code": "cycle-approximation",
      "message": "cycle-approximation"
    },
    {
      "code": "denylist-pruned",
      "message": "denylist-pruned"
    },
    {
      "code": "directory-as-module",
      "message": "directory-as-module"
    },
    {
      "code": "error-budget",
      "message": "error-budget"
    },
    {
      "code": "name-resolved-edges",
      "message": "name-resolved-edges"
    },
    {
      "code": "unsupported-metric",
      "message": "unsupported-metric"
    }
  ],
  "status": "partial"
}
