{
  "schemaVersion": "1.3",
  "language": "go",
  "modules": [
    {
      "path": "pkg/omega",
      "name": "pkg/omega",
      "ca": 0,
      "ce": 3,
      "exportedTypes": 1,
      "abstractTypes": 0,
      "instability": 0.94,
      "abstractness": 0.9,
      "distance": 0.2,
      "lcom": 2,
      "zone": "zone-of-uselessness",
      "duplications": [
        {
          "modulePath": "pkg/omega",
          "blocks": [
            {
              "file": "x/a.go",
              "startLine": 10,
              "endLine": 25,
              "lineCount": 16
            },
            {
              "file": "x/b.go",
              "startLine": 40,
              "endLine": 55,
              "lineCount": 16
            }
          ],
          "similarity": 0.9
        }
      ],
      "totalLines": 300
    },
    {
      "path": "pkg/alpha",
      "name": "pkg/alpha",
      "ca": 12,
      "ce": 0,
      "exportedTypes": 1,
      "abstractTypes": 0,
      "instability": 0.06,
      "abstractness": 0.5,
      "distance": 0.44,
      "lcom": 1,
      "zone": "main-sequence",
      "duplications": [],
      "totalLines": 500
    }
  ],
  "cycles": [
    [
      "pkg/alpha",
      "pkg/omega"
    ]
  ],
  "warnings": [
    {
      "code": "load-error",
      "message": "package pkg/gone: type information unavailable",
      "module": "pkg/gone"
    }
  ],
  "status": "complete",
  "provenance": {
    "producer": "vibe-check",
    "version": "1.2.3",
    "generatedAt": "2026-01-15T10:30:00Z",
    "input": {
      "path": ".",
      "modulePath": "example.com/project"
    }
  }
}
