{
  "schemaVersion": "1.1",
  "language": "go",
  "modules": [
    {
      "path": "example.com/app/a",
      "name": "a",
      "ca": 1,
      "ce": 1,
      "instability": 0.5,
      "abstractness": 0.0,
      "distance": 0.5,
      "lcom": 1,
      "exportedTypes": 2,
      "abstractTypes": 0,
      "zone": "normal"
    }
  ],
  "cycles": [],
  "warnings": [
    {
      "code": "load-error",
      "message": "could not type-check package",
      "module": "example.com/app/a"
    }
  ],
  "status": "partial"
}
